{
  "pack_name": "task_pack_v1",
  "pack_version": "1.1.0",
  "generator_seed": 1337,
  "categories": [
    "string_regex_parsing",
    "ds_algo",
    "file_io_serialization",
    "concurrency_basics",
    "numerical_edge_cases",
    "multi_file_mini_module"
  ],
  "counts": {
    "total": 300,
    "train": 200,
    "dev": 50,
    "test": 50,
    "quick": 18
  },
  "category_counts": {
    "concurrency_basics": 50,
    "ds_algo": 50,
    "file_io_serialization": 50,
    "multi_file_mini_module": 50,
    "numerical_edge_cases": 50,
    "string_regex_parsing": 50
  },
  "tasks": [
    {
      "task_id": "v1_concurrency_basics_000",
      "title": "Concurrent jobs 000",
      "category": "concurrency_basics",
      "difficulty": "medium",
      "split": "train",
      "quick": false,
      "path": "tasks/v1_concurrency_basics_000"
    },
    {
      "task_id": "v1_concurrency_basics_001",
      "title": "Concurrent jobs 001",
      "category": "concurrency_basics",
      "difficulty": "medium",
      "split": "train",
      "quick": false,
      "path": "tasks/v1_concurrency_basics_001"
    },
    {
      "task_id": "v1_concurrency_basics_002",
      "title": "Concurrent jobs 002",
      "category": "concurrency_basics",
      "difficulty": "medium",
      "split": "train",
      "quick": false,
      "path": "tasks/v1_concurrency_basics_002"
    },
    {
      "task_id": "v1_concurrency_basics_003",
      "title": "Concurrent jobs 003",
      "category": "concurrency_basics",
      "difficulty": "easy",
      "split": "train",
      "quick": false,
      "path": "tasks/v1_concurrency_basics_003"
    },
    {
      "task_id": "v1_concurrency_basics_004",
      "title": "Concurrent jobs 004",
      "category": "concurrency_basics",
      "difficulty": "easy",
      "split": "train",
      "quick": false,
      "path": "tasks/v1_concurrency_basics_004"
    },
    {
      "task_id": "v1_concurrency_basics_005",
      "title": "Concurrent jobs 005",
      "category": "concurrency_basics",
      "difficulty": "hard",
      "split": "train",
      "quick": false,
      "path": "tasks/v1_concurrency_basics_005"
    },
    {
      "task_id": "v1_concurrency_basics_006",
      "title": "Concurrent jobs 006",
      "category": "concurrency_basics",
      "difficulty": "hard",
      "split": "dev",
      "quick": false,
      "path": "tasks/v1_concurrency_basics_006"
    },
    {
      "task_id": "v1_concurrency_basics_007",
      "title": "Concurrent jobs 007",
      "category": "concurrency_basics",
      "difficulty": "medium",
      "split": "test",
      "quick": false,
      "path": "tasks/v1_concurrency_basics_007"
    },
    {
      "task_id": "v1_concurrency_basics_008",
      "title": "Concurrent jobs 008",
      "category": "concurrency_basics",
      "difficulty": "hard",
      "split": "train",
      "quick": false,
      "path": "tasks/v1_concurrency_basics_008"
    },
    {
      "task_id": "v1_concurrency_basics_009",
      "title": "Concurrent jobs 009",
      "category": "concurrency_basics",
      "difficulty": "easy",
      "split": "test",
      "quick": false,
      "path": "tasks/v1_concurrency_basics_009"
    },
    {
      "task_id": "v1_concurrency_basics_010",
      "title": "Concurrent jobs 010",
      "category": "concurrency_basics",
      "difficulty": "easy",
      "split": "test",
      "quick": false,
      "path": "tasks/v1_concurrency_basics_010"
    },
    {
      "task_id": "v1_concurrency_basics_011",
      "title": "Concurrent jobs 011",
      "category": "concurrency_basics",
      "difficulty": "easy",
      "split": "train",
      "quick": false,
      "path": "tasks/v1_concurrency_basics_011"
    },
    {
      "task_id": "v1_concurrency_basics_012",
      "title": "Concurrent jobs 012",
      "category": "concurrency_basics",
      "difficulty": "easy",
      "split": "train",
      "quick": false,
      "path": "tasks/v1_concurrency_basics_012"
    },
    {
      "task_id": "v1_concurrency_basics_013",
      "title": "Concurrent jobs 013",
      "category": "concurrency_basics",
      "difficulty": "hard",
      "split": "train",
      "quick": false,
      "path": "tasks/v1_concurrency_basics_013"
    },
    {
      "task_id": "v1_concurrency_basics_014",
      "title": "Concurrent jobs 014",
      "category": "concurrency_basics",
      "difficulty": "easy",
      "split": "train",
      "quick": false,
      "path": "tasks/v1_concurrency_basics_014"
    },
    {
      "task_id": "v1_concurrency_basics_015",
      "title": "Concurrent jobs 015",
      "category": "concurrency_basics",
      "difficulty": "medium",
      "split": "dev",
      "quick": false,
      "path": "tasks/v1_concurrency_basics_015"
    },
    {
      "task_id": "v1_concurrency_basics_016",
      "title": "Concurrent jobs 016",
      "category": "concurrency_basics",
      "difficulty": "medium",
      "split": "train",
      "quick": false,
      "path": "tasks/v1_concurrency_basics_016"
    },
    {
      "task_id": "v1_concurrency_basics_017",
      "title": "Concurrent jobs 017",
      "category": "concurrency_basics",
      "difficulty": "medium",
      "split": "dev",
      "quick": false,
      "path": "tasks/v1_concurrency_basics_017"
    },
    {
      "task_id": "v1_concurrency_basics_018",
      "title": "Concurrent jobs 018",
      "category": "concurrency_basics",
      "difficulty": "hard",
      "split": "train",
      "quick": false,
      "path": "tasks/v1_concurrency_basics_018"
    },
    {
      "task_id": "v1_concurrency_basics_019",
      "title": "Concurrent jobs 019",
      "category": "concurrency_basics",
      "difficulty": "easy",
      "split": "dev",
      "quick": false,
      "path": "tasks/v1_concurrency_basics_019"
    },
    {
      "task_id": "v1_concurrency_basics_020",
      "title": "Concurrent jobs 020",
      "category": "concurrency_basics",
      "difficulty": "medium",
      "split": "test",
      "quick": false,
      "path": "tasks/v1_concurrency_basics_020"
    },
    {
      "task_id": "v1_concurrency_basics_021",
      "title": "Concurrent jobs 021",
      "category": "concurrency_basics",
      "difficulty": "easy",
      "split": "train",
      "quick": false,
      "path": "tasks/v1_concurrency_basics_021"
    },
    {
      "task_id": "v1_concurrency_basics_022",
      "title": "Concurrent jobs 022",
      "category": "concurrency_basics",
      "difficulty": "medium",
      "split": "train",
      "quick": false,
      "path": "tasks/v1_concurrency_basics_022"
    },
    {
      "task_id": "v1_concurrency_basics_023",
      "title": "Concurrent jobs 023",
      "category": "concurrency_basics",
      "difficulty": "medium",
      "split": "train",
      "quick": false,
      "path": "tasks/v1_concurrency_basics_023"
    },
    {
      "task_id": "v1_concurrency_basics_024",
      "title": "Concurrent jobs 024",
      "category": "concurrency_basics",
      "difficulty": "medium",
      "split": "train",
      "quick": false,
      "path": "tasks/v1_concurrency_basics_024"
    },
    {
      "task_id": "v1_concurrency_basics_025",
      "title": "Concurrent jobs 025",
      "category": "concurrency_basics",
      "difficulty": "medium",
      "split": "train",
      "quick": false,
      "path": "tasks/v1_concurrency_basics_025"
    },
    {
      "task_id": "v1_concurrency_basics_026",
      "title": "Concurrent jobs 026",
      "category": "concurrency_basics",
      "difficulty": "medium",
      "split": "train",
      "quick": false,
      "path": "tasks/v1_concurrency_basics_026"
    },
    {
      "task_id": "v1_concurrency_basics_027",
      "title": "Concurrent jobs 027",
      "category": "concurrency_basics",
      "difficulty": "medium",
      "split": "train",
      "quick": false,
      "path": "tasks/v1_concurrency_basics_027"
    },
    {
      "task_id": "v1_concurrency_basics_028",
      "title": "Concurrent jobs 028",
      "category": "concurrency_basics",
      "difficulty": "easy",
      "split": "test",
      "quick": false,
      "path": "tasks/v1_concurrency_basics_028"
    },
    {
      "task_id": "v1_concurrency_basics_029",
      "title": "Concurrent jobs 029",
      "category": "concurrency_basics",
      "difficulty": "medium",
      "split": "train",
      "quick": false,
      "path": "tasks/v1_concurrency_basics_029"
    },
    {
      "task_id": "v1_concurrency_basics_030",
      "title": "Concurrent jobs 030",
      "category": "concurrency_basics",
      "difficulty": "medium",
      "split": "test",
      "quick": false,
      "path": "tasks/v1_concurrency_basics_030"
    },
    {
      "task_id": "v1_concurrency_basics_031",
      "title": "Concurrent jobs 031",
      "category": "concurrency_basics",
      "difficulty": "hard",
      "split": "dev",
      "quick": false,
      "path": "tasks/v1_concurrency_basics_031"
    },
    {
      "task_id": "v1_concurrency_basics_032",
      "title": "Concurrent jobs 032",
      "category": "concurrency_basics",
      "difficulty": "hard",
      "split": "train",
      "quick": false,
      "path": "tasks/v1_concurrency_basics_032"
    },
    {
      "task_id": "v1_concurrency_basics_033",
      "title": "Concurrent jobs 033",
      "category": "concurrency_basics",
      "difficulty": "medium",
      "split": "train",
      "quick": false,
      "path": "tasks/v1_concurrency_basics_033"
    },
    {
      "task_id": "v1_concurrency_basics_034",
      "title": "Concurrent jobs 034",
      "category": "concurrency_basics",
      "difficulty": "hard",
      "split": "test",
      "quick": false,
      "path": "tasks/v1_concurrency_basics_034"
    },
    {
      "task_id": "v1_concurrency_basics_035",
      "title": "Concurrent jobs 035",
      "category": "concurrency_basics",
      "difficulty": "easy",
      "split": "dev",
      "quick": false,
      "path": "tasks/v1_concurrency_basics_035"
    },
    {
      "task_id": "v1_concurrency_basics_036",